{
  "id": "5-verbal-012",
  "package": 5,
  "subtest": "verbal",
  "number": 12,
  "type": "analogi",
  "question_text": "BENIH : TANAMAN = ... : ...",
  "image": null,
  "passage": null,
  "options": [
    {"key": "A", "text": "Pupuk : Subur"},
    {"key": "B", "text": "Buku : Halaman"},
    {"key": "C", "text": "Prototipe : Perancang"},
    {"key": "D", "text": "Gagasan : Inovasi"},
    {"key": "E", "text": "Awan : Hujan"}
  ],
  "correct_option": "D",
  "explanations": {
    "A": "Pupuk dapat menyebabkan tanaman subur, tetapi subur adalah sifat, bukan bentuk yang berkembang dari pupuk.",
    "B": "Halaman merupakan bagian dari buku, sedangkan tanaman berkembang dari benih.",
    "C": "Prototipe dibuat oleh perancang sehingga hubungan hasil dan pembuatnya tidak sama dengan asal dan hasil perkembangan.",
    "D": "Benar. Tanaman berkembang dari benih, sebagaimana inovasi dapat berkembang dari suatu gagasan.",
    "E": "Hujan turun dari awan melalui proses cuaca, tetapi awan bukan bentuk awal yang tumbuh menjadi hujan."
  },
  "difficulty": "medium",
  "source": "codex-generated",
  "verified": true
}
