{
  "id": "1-kuantitatif-014",
  "package": 1,
  "subtest": "kuantitatif",
  "number": 14,
  "type": "perbandingan_kuantitatif",
  "question_text": "Perhatikan dua besaran berikut.\nP = luas persegi yang panjang sisinya 8 cm\nQ = luas persegi panjang berukuran 8 cm × 12 cm\nManakah pernyataan yang benar mengenai hubungan P dan Q?",
  "image": null,
  "passage": null,
  "options": [
    {
      "key": "A",
      "text": "P lebih besar daripada Q"
    },
    {
      "key": "B",
      "text": "Q lebih besar daripada P"
    },
    {
      "key": "C",
      "text": "P sama dengan Q"
    },
    {
      "key": "D",
      "text": "Hubungan P dan Q tidak dapat ditentukan dari informasi yang diberikan"
    },
    {
      "key": "E",
      "text": "P dan Q keduanya merupakan bilangan ganjil"
    }
  ],
  "correct_option": "B",
  "explanations": {
    "A": "Salah. P = 64 cm² dan Q = 96 cm², sehingga Q > P; nilai P tidak melebihi nilai Q (64 cm² tidak lebih besar daripada 96 cm²).",
    "B": "Benar. P = 64 cm² dan Q = 96 cm², sehingga Q > P.",
    "C": "Salah. P = 64 cm² dan Q = 96 cm², sehingga Q > P; kedua nilai tidak sama (64 cm² ≠ 96 cm²).",
    "D": "Salah. Kedua besaran dapat dihitung pasti dari informasi yang diberikan (P = 64 cm² dan Q = 96 cm²), sehingga hubungannya dapat ditentukan.",
    "E": "Salah. P = 64 cm² dan Q = 96 cm², sekurang-kurangnya salah satu di antaranya bukan bilangan ganjil."
  },
  "difficulty": "medium",
  "source": "aritmetika.py",
  "verified": true
}
