{
  "id": "12-verbal-018",
  "package": 12,
  "subtest": "verbal",
  "number": 18,
  "type": "kalimat_efektif",
  "question_text": "Kalimat yang paling efektif dan sesuai dengan kaidah bahasa Indonesia adalah ...",
  "image": null,
  "passage": null,
  "options": [
    {"key": "A", "text": "Berdasarkan data tersebut dapat disimpulkan bahwa indeks kepercayaan konsumen menurun."},
    {"key": "B", "text": "Surat yang saya kirimkan kemarin sudah diterima oleh pihak kampus."},
    {"key": "C", "text": "Pada saat itu, situasi di lapangan berubah menjadi sangat cepat sekali."},
    {"key": "D", "text": "Meskipun harganya murah, akan tetapi kualitasnya tidak murahan."},
    {"key": "E", "text": "Para hadirin yang terhormat, dimohon untuk dapat berdiri tegak."}
  ],
  "correct_option": "B",
  "explanations": {
    "A": "Frase 'Berdasarkan data tersebut dapat disimpulkan' tidak memiliki subjek jelas; lebih baik 'Data tersebut menunjukkan bahwa'.",
    "B": "Benar. Kalimat sederhana dengan subjek-predikat-objek yang jelas, tidak ada pleonasme, dan kontekstual.",
    "C": "Penggunaan 'pada saat itu' dan 'sangat' serta 'sekali' sekaligus merupakan pemborosan kata.",
    "D": "Konjungsi 'Meskipun' dan 'akan tetapi' tidak boleh digunakan bersamaan dalam satu kalimat.",
    "E": "Bentuk 'dimohon untuk dapat berdiri' mengandung pleonasme; lebih ringkas 'dimohon berdiri'."
  },
  "difficulty": "medium",
  "source": "MiniMax-M3-generated",
  "verified": true
}
