{
  "id": "11-kuantitatif-019",
  "package": 11,
  "subtest": "kuantitatif",
  "number": 19,
  "type": "kecukupan_data",
  "question_text": "Pada gambar di atas, ABD dan ABC adalah segitiga siku-siku dengan AD tegak lurus AB dan BC tegak lurus AB. Titik C dan titik D berada pada sisi yang sama terhadap AB, sedangkan AC dan BD berpotongan di titik E. Berapakah jarak titik E ke AB?\n(1) Jumlah panjang AD dan BC adalah 18 cm.\n(2) Selisih panjang BC dan AD adalah 6 cm.\nPutuskan apakah pernyataan (1) dan (2) yang diberikan cukup untuk menjawab pertanyaan tersebut.",
  "image": "images/kd-dua-segitiga-siku.svg",
  "passage": null,
  "options": [
    {
      "key": "A",
      "text": "Pernyataan (1) SAJA cukup untuk menjawab pertanyaan, tetapi pernyataan (2) SAJA tidak cukup"
    },
    {
      "key": "B",
      "text": "Pernyataan (2) SAJA cukup untuk menjawab pertanyaan, tetapi pernyataan (1) SAJA tidak cukup"
    },
    {
      "key": "C",
      "text": "DUA pernyataan BERSAMA-SAMA cukup untuk menjawab pertanyaan, tetapi SATU pernyataan SAJA tidak cukup"
    },
    {
      "key": "D",
      "text": "Pernyataan (1) SAJA cukup untuk menjawab pertanyaan dan pernyataan (2) SAJA cukup untuk menjawab pertanyaan"
    },
    {
      "key": "E",
      "text": "Pernyataan (1) dan (2) BERSAMA-SAMA tidak cukup untuk menjawab pertanyaan"
    }
  ],
  "correct_option": "C",
  "explanations": {
    "A": "Salah. Pernyataan (1) saja tidak cukup, sebab keadaan [AD = 6 cm, BC = 12 cm, AB = 18 cm] dan [AD = 3 cm, BC = 15 cm, AB = 18 cm] sama-sama memenuhinya, tetapi memberikan jarak titik E ke AB sebesar 4 cm dan 2,5 cm.",
    "B": "Salah. Pernyataan (2) saja tidak cukup, sebab keadaan [AD = 6 cm, BC = 12 cm, AB = 18 cm] dan [AD = 7 cm, BC = 13 cm, AB = 18 cm] sama-sama memenuhinya, tetapi memberikan jarak titik E ke AB sebesar 4 cm dan 4,55 cm.",
    "C": "Benar. Jarak titik E ke AB selalu sama dengan (AD × BC)/(AD + BC), yaitu hanya ditentukan oleh AD dan BC; panjang AB tidak memengaruhinya sama sekali. Pernyataan (1) dan (2) bersama-sama menentukan jarak titik E ke AB secara tunggal, yaitu 4 cm; pernyataan (1) saja tidak cukup, sebab keadaan [AD = 6 cm, BC = 12 cm, AB = 18 cm] dan [AD = 3 cm, BC = 15 cm, AB = 18 cm] sama-sama memenuhinya, tetapi memberikan jarak titik E ke AB sebesar 4 cm dan 2,5 cm; pernyataan (2) saja tidak cukup, sebab keadaan [AD = 6 cm, BC = 12 cm, AB = 18 cm] dan [AD = 7 cm, BC = 13 cm, AB = 18 cm] sama-sama memenuhinya, tetapi memberikan jarak titik E ke AB sebesar 4 cm dan 4,55 cm.",
    "D": "Salah. Pernyataan (1) saja tidak cukup, sebab keadaan [AD = 6 cm, BC = 12 cm, AB = 18 cm] dan [AD = 3 cm, BC = 15 cm, AB = 18 cm] sama-sama memenuhinya, tetapi memberikan jarak titik E ke AB sebesar 4 cm dan 2,5 cm.",
    "E": "Salah. Pernyataan (1) dan (2) bersama-sama menentukan jarak titik E ke AB secara tunggal, yaitu 4 cm."
  },
  "difficulty": "hard",
  "source": "kecukupan_data.py",
  "verified": true
}
