{
  "id": "8-kuantitatif-015",
  "package": 8,
  "subtest": "kuantitatif",
  "number": 15,
  "type": "perbandingan_kuantitatif",
  "question_text": "Perhatikan dua besaran berikut.\nP = 20% dari 200\nQ = 7/8 dari 200\nManakah pernyataan yang benar mengenai hubungan P dan Q?",
  "image": null,
  "passage": null,
  "options": [
    {
      "key": "A",
      "text": "P lebih besar daripada Q"
    },
    {
      "key": "B",
      "text": "Q lebih besar daripada P"
    },
    {
      "key": "C",
      "text": "P sama dengan Q"
    },
    {
      "key": "D",
      "text": "Hubungan P dan Q tidak dapat ditentukan dari informasi yang diberikan"
    },
    {
      "key": "E",
      "text": "P dan Q keduanya merupakan bilangan ganjil"
    }
  ],
  "correct_option": "B",
  "explanations": {
    "A": "Salah. P = 40 dan Q = 175, sehingga Q > P; nilai P tidak melebihi nilai Q (40 tidak lebih besar daripada 175).",
    "B": "Benar. P = 40 dan Q = 175, sehingga Q > P.",
    "C": "Salah. P = 40 dan Q = 175, sehingga Q > P; kedua nilai tidak sama (40 ≠ 175).",
    "D": "Salah. Kedua besaran dapat dihitung pasti dari informasi yang diberikan (P = 40 dan Q = 175), sehingga hubungannya dapat ditentukan.",
    "E": "Salah. P = 40 dan Q = 175, P bukan bilangan ganjil."
  },
  "difficulty": "easy",
  "source": "aritmetika.py",
  "verified": true
}
