{
  "id": "14-kuantitatif-007",
  "package": 14,
  "subtest": "kuantitatif",
  "number": 7,
  "type": "perbandingan_kuantitatif",
  "question_text": "Perhatikan dua besaran berikut.\nDiketahui x = 3.\nP = 4x − 1\nQ = 6x + 6\nManakah pernyataan yang benar mengenai hubungan P dan Q?",
  "image": null,
  "passage": null,
  "options": [
    {
      "key": "A",
      "text": "P lebih besar daripada Q"
    },
    {
      "key": "B",
      "text": "Q lebih besar daripada P"
    },
    {
      "key": "C",
      "text": "P sama dengan Q"
    },
    {
      "key": "D",
      "text": "Hubungan P dan Q tidak dapat ditentukan dari informasi yang diberikan"
    },
    {
      "key": "E",
      "text": "Jumlah P dan Q kurang daripada 30"
    }
  ],
  "correct_option": "B",
  "explanations": {
    "A": "Salah. P = 11 dan Q = 24, sehingga Q > P; nilai P tidak melebihi nilai Q (11 tidak lebih besar daripada 24).",
    "B": "Benar. P = 11 dan Q = 24, sehingga Q > P.",
    "C": "Salah. P = 11 dan Q = 24, sehingga Q > P; kedua nilai tidak sama (11 ≠ 24).",
    "D": "Salah. Kedua besaran dapat dihitung pasti dari informasi yang diberikan (P = 11 dan Q = 24), sehingga hubungannya dapat ditentukan.",
    "E": "Salah. P = 11 dan Q = 24, jumlahnya 35, tidak kurang daripada 30."
  },
  "difficulty": "medium",
  "source": "aritmetika.py",
  "verified": true
}